{
  "id": "draft",
  "name": "写稿",
  "agent": "novelist",
  "inputs": {
    "task": { "type": "string", "required": true },
    "outline": { "type": "string", "required": true },
    "target_word_count": { "type": "number", "required": false, "default": 3500 },
    "project_dir": { "type": "string", "required": false }
  },
  "outputs": {
    "draft_content": { "type": "string", "description": "章节正文草稿" }
  },
  "output_file": {
    "file": "正文/{volume}/草稿.md",
    "output_keys": ["draft_content"]
  }
}
